{
  "$schema": "https://json-schema.org/draft/2020-12/schema",
  "$id": "https://ai-design-platform.dev/schema/v2/standardized-prd.schema.json",
  "type": "object",
  "required": ["version", "id", "summary", "goals", "users", "scope", "pages", "flows", "contentRequirements", "componentRequirements", "interactions", "responsive", "accessibility", "constraints", "assumptions", "openQuestions", "blockingIssues"],
  "additionalProperties": false,
  "properties": {
    "version": { "const": "2.0.0" },
    "id": { "type": "string", "minLength": 1 },
    "summary": { "type": "string", "minLength": 1 },
    "goals": { "type": "array", "items": { "type": "string", "minLength": 1 } },
    "users": { "type": "array", "items": { "$ref": "#/$defs/namedItem" } },
    "scope": {
      "type": "object",
      "required": ["in", "out"],
      "additionalProperties": false,
      "properties": {
        "in": { "type": "array", "items": { "type": "string" } },
        "out": { "type": "array", "items": { "type": "string" } }
      }
    },
    "pages": { "type": "array", "items": { "$ref": "#/$defs/page" }, "minItems": 1 },
    "flows": { "type": "array", "items": { "$ref": "#/$defs/flow" } },
    "contentRequirements": { "type": "array", "items": { "$ref": "#/$defs/requirement" } },
    "componentRequirements": { "type": "array", "items": { "$ref": "#/$defs/requirement" } },
    "interactions": { "type": "array", "items": { "$ref": "#/$defs/requirement" } },
    "responsive": { "type": "array", "items": { "$ref": "#/$defs/requirement" } },
    "accessibility": { "type": "array", "items": { "$ref": "#/$defs/requirement" } },
    "constraints": { "type": "array", "items": { "$ref": "#/$defs/requirement" } },
    "assumptions": { "type": "array", "items": { "$ref": "#/$defs/assumption" } },
    "openQuestions": { "type": "array", "items": { "$ref": "#/$defs/assumption" } },
    "blockingIssues": { "type": "array", "items": { "$ref": "#/$defs/assumption" } }
  },
  "$defs": {
    "namedItem": {
      "type": "object",
      "required": ["id", "text"],
      "additionalProperties": false,
      "properties": { "id": { "type": "string", "minLength": 1 }, "text": { "type": "string", "minLength": 1 } }
    },
    "page": {
      "type": "object",
      "required": ["id", "name", "purpose"],
      "additionalProperties": false,
      "properties": {
        "id": { "type": "string", "minLength": 1 },
        "name": { "type": "string", "minLength": 1 },
        "purpose": { "type": "string", "minLength": 1 },
        "states": { "type": "array", "items": { "type": "string" } }
      }
    },
    "flow": {
      "type": "object",
      "required": ["id", "name", "steps"],
      "additionalProperties": false,
      "properties": {
        "id": { "type": "string", "minLength": 1 },
        "name": { "type": "string", "minLength": 1 },
        "steps": { "type": "array", "minItems": 1, "items": { "$ref": "#/$defs/step" } }
      }
    },
    "step": {
      "type": "object",
      "required": ["id", "pageId", "action"],
      "additionalProperties": false,
      "properties": {
        "id": { "type": "string", "minLength": 1 },
        "pageId": { "type": "string", "minLength": 1 },
        "action": { "type": "string", "minLength": 1 },
        "result": { "type": "string" }
      }
    },
    "requirement": {
      "type": "object",
      "required": ["id", "text"],
      "additionalProperties": false,
      "properties": {
        "id": { "type": "string", "minLength": 1 },
        "text": { "type": "string", "minLength": 1 },
        "source": { "type": "string" },
        "priority": { "enum": ["must", "should", "could"] }
      }
    },
    "assumption": {
      "type": "object",
      "required": ["id", "text"],
      "additionalProperties": false,
      "properties": {
        "id": { "type": "string", "minLength": 1 },
        "text": { "type": "string", "minLength": 1 },
        "blocking": { "type": "boolean" }
      }
    }
  }
}
